username,userid,profile_location,created_at,text,retweet_count,source,coordinates
Will Baizer,298725759,"Austin, TX",2023-01-22 22:17:29,"I would like to point out that, as of today, Texas Tech is 0-7 in Big 12 play.",4,Twitter for iPhone,
Conservative Patriot,1600363387447296000,"Austin, Tx",2023-01-22 20:07:32,"@TockTick5167AD @POTUS Yet Dems pushed vaccine and mask mandates, school closures and lockdowns. Sounds like totali… https://t.co/4o8GWcpKF2",0,Twitter for iPhone,
Fehzan Ali ❎,256669854,"Austin, Texas",2023-01-22 19:18:43,"@pkedrosky Not a fan either, but it's obvious and been obvious there is a significant amount of over hiring in big tech.",0,Twitter Web App,
Middlebrow Elitist,1429183978578358283,"Austin, TX",2023-01-22 17:20:15,Big tech invents picture books https://t.co/FtXNX5gdg9,0,Twitter for iPhone,
Wetterschneider,559068947,"Austin, Texas",2023-01-22 16:53:50,"@gauravmunjal @amitgupta0310 Big orgs don't have to BE nimble - you should know this.

They just need the money to… https://t.co/uMvDHToSl7",2,TweetDeck,
Balaji V 🚢,14182044,"Austin, TX",2023-01-22 15:30:48,"Economy shifted, corporate priorities and pressures on management shifted, easy money was gone. In the world of big… https://t.co/22bh4hj9Is",0,Typeshare.co,
John Benavides,1534331746497576961,"Austin, TX",2023-01-22 14:34:12,"@BeyondUltra1 @libertycappy ….big tech, defense, real estate, and Hollywood… guess who’s job it is to keep them fro… https://t.co/aCs3MAaAQi",0,Twitter for iPhone,
Ron,1591508661385453568,"Austin, TX",2023-01-22 14:20:56,"@LauraLoomer One of the many reasons I and many, many others USE LESS BIG TECH (just recently returned to Twitter,… https://t.co/1mw87oe5ug",0,Twitter Web App,
Alex Bass (Efficient VC),93567446,"Austin, TX",2023-01-22 14:18:27,"@terronk @inklingcam @sveta_bay @ProductHunt To be fair, give me an engineer and a no-code Bubble expert and I'm wi… https://t.co/ev62d8Ri8w",0,Twitter for Android,
Austin Statesman,5692542,"Austin, Texas",2023-01-22 12:00:03,No. 25 Texas looks to rebound from upset loss at Texas Tech against now-unranked Baylor https://t.co/iluVLRLyL4,0,SocialNewsDesk,
Gilbert Martinez,75448777,"Austin,Tx",2023-01-22 02:37:52,"@MedStuBurner @vivathematadors While Tech claims a culture win, they remain winless in Big 12 up to this point.",0,Twitter for Android,
Arran James Stewart,473810209,"Austin, TX",2023-01-22 01:27:34,"As always it was a pleasure to join Scott Budman  at CNBC  to talk about the Google  layoffs.

Big tech is averagel… https://t.co/F7yOnCYigk",0,LinkedIn,
Arran James Stewart,473810209,"Austin, TX",2023-01-22 01:15:56,"As always it was a pleasure to join Scott Budman at CNBC to talk about the Google layoffs.

Big tech is averagely l… https://t.co/tkbcb00IJ4",0,LinkedIn,
KXAN News,15169032,"Austin, Texas",2023-01-22 01:15:07,"Even with some turmoil in the tech sector, the Austin metro's economy is growing. Is Austin insulated from these bi… https://t.co/ITcv0Oifbj",0,SocialFlow,
The Dirty Team,1486362551441100805,"Austin, Texas",2023-01-22 00:58:48,"Fast Company Grill is back for SXSW 2023, March 10-13 from 10:30am-6pm daily at The Cedar Door on 201 Brazos

RSVP:… https://t.co/Au9biH8cTs",3,Twitter for iPhone,
Barstool Longhorns,2414922230,"Austin, TX ",2023-01-22 00:13:40,"@OccupyLF Yeah couldn’t agree more, only team that could be worse than Tech in the Big 12",0,Twitter for iPhone,
Marshall Kosloff,3354067385,"Austin, TX",2023-01-22 00:09:32,"@grantadever I’m seeing this take on tech adjacent twitter, and I don’t get it?

A) A ton of big things occurred du… https://t.co/nbDikJeTGE",0,Twitter for iPhone,
Patrice Baker,1543688181396242432,"georgetown, tx",2023-01-21 23:24:20,"@gatewaypundit @elonmusk I'm so sorry that you and your brother suffered from the jab. We need to prosecute Fauci,… https://t.co/SZxoIb6Uek",0,Twitter for Android,
Dan Isett 🌵 🏴‍☠️,20247181,"Austin, TX / Washington, DC",2023-01-21 21:30:20,How bad does it have to get for 0-7 in the Big 12 Texas Tech for Adams to be out? #WreckEm,0,Twitter for Android,
Steven Wartofsky,1556786559206178822,"Cedar Park, TX",2023-01-21 21:21:11,"@ewarren What is happening now is, tech is using big layoffs to get rid of their over-30 staff, like they always do… https://t.co/MWkIGnJhtL",0,Twitter for iPhone,
Hookem.com,15165715,"Austin, Tx",2023-01-21 21:18:02,No. 25 Texas looks to rebound from upset loss at Texas Tech against now-unranked Baylor https://t.co/3oX262f8m9,1,SocialNewsDesk,
Dave Cook,1465523718143283202,Austin Texas,2023-01-21 20:29:17,"@ScottAdamsSays Second note:  Want to up your conspiracy?  I think you are fine and were not hurt by the shot.

Rea… https://t.co/MeGRCxEzKy",1,Twitter Web App,
Ron,1591508661385453568,"Austin, TX",2023-01-21 20:15:09,@liberty_lyss Please use https://t.co/Ps923uorId and use less Big Tech.,0,Twitter Web App,
FUTO,1518632513580810241,"Austin, TX",2023-01-21 18:37:05,Big if true. https://t.co/7IhKGlfJsJ,1,Twitter Web App,
ardon,2478794796,"Austin, TX",2023-01-21 16:42:47,"Shots fired.

I know a good amount of farmer-types-tech-expats more satisfied w/ life.

The hard work is a big part… https://t.co/DHdkD8Yq9c",0,Twitter Web App,
Patrick W. Watson,11104872,"Dripping Springs, Texas",2023-01-21 14:35:11,"It’s not just tech, it’s all big companies. Businesses get more callous with size because there’s more distance bet… https://t.co/8DlF60IyKS",16,Twitter for iPhone,
AustinBizJournal,24037404,"Austin, Texas ",2023-01-21 14:00:21,Money raised by Austin companies last week will help tech companies find remote employees in Latin America; underwr… https://t.co/9NtQ5rdC6D,0,True Anthem,
Rob Leathern,5449042,"Austin, TX",2023-01-21 13:04:47,"As for me, I’ll finally take that vacation ‘recharge’ I missed by splitting my 6 years in big tech across Facebook/… https://t.co/iSGn0E8Lua",0,Twitter for iPhone,
HHHHH,2715772722,Aus,2023-01-21 07:55:25,"@Timcast @scrowder crowder is boosting his platform at the expense of dw. 
personally i do think dw has restraint o… https://t.co/NAnwGRLaLf",0,Twitter Web App,
nic sosa,177252996,"Buda, TX",2023-01-21 05:31:59,"@elonsgrandson @foerglikecyborg @TheQuartering @realDailyWire as candace said on timcast, crowder indirectly called… https://t.co/UCO9LGGNFo",0,Twitter Web App,
Emma Beverage #NoMore #AbolishPolice #LandBack,143904132,"Austin, TX",2023-01-21 05:23:59,"SCOTUS Looking For ROE Leaker, US Debt Ceiling Crisis, Big Tech Layoffs ... https://t.co/MiAQwBTwbI via @YouTube",0,Twitter Web App,
Paco,4036077013,"Austin, TX",2023-01-21 04:45:51,@walkerjian @jcj Bro I doubt anyone at big tech have stock in the company they work for,0,Twitter for iPhone,
Prospector,1519844012978765824,Aus,2023-01-21 03:33:28,"@DoctorJustice1 I don't know if they are controlled opposition. 🤷

But they are all in a parasitic relationship wit… https://t.co/gll8rRgQON",0,Twitter Web App,
Colin Pear,302811479,"Austin, TX",2023-01-21 03:12:15,"@manekinekko Oh boy. Good to know. For a minute there, I was certain that all the big tech layoffs were happening b… https://t.co/miIaGLPGyT",0,Twitter for Android,
matty.,1482769455218413574,"Austin, TX",2023-01-21 02:25:52,"Outside of Tech, Kansas State and West Virginia are probably my favorite fan bases in the Big 12.  Damn shame they’… https://t.co/p9j3CxfSaa",0,Twitter for iPhone,
Cheetoh Fingers,53183278,Austin,2023-01-21 02:18:49,"@IanColdwater A lot of smaller, but growing tech companies who need to scale efficiently could really use folks fro… https://t.co/p2DAq9ImWM",0,Twitter for iPhone,
Jon Kozak,1023202661447950337,"Austin, TX",2023-01-21 02:00:35,"Big win for Andy Smith over Isaac Trumble - that locks up the dual for Virginia Tech!

Incredible dual",0,Twitter Web App,
Verdict,1270795774364913666,"Austin, TX",2023-01-21 01:22:08,@kosmickoehn @SladeX2000 @pastorb_ifb @Fillenwar1Dalen @benshapiro He may be demonetized but he uses big tech to re… https://t.co/PKKpbDdPu4,0,Twitter for Android,
Matty IceT,887892512,Austin Tx,2023-01-21 01:19:54,@JasonVaughn @Kellyatthebeach @HarrisonKrank The point is they shouldn’t be relying on YouTube(big tech) monetization to be profitable.,0,Twitter for iPhone,
Prospector,1519844012978765824,Aus,2023-01-21 01:18:34,"@Timcast @scrowder It seems the main problem is the hosting, &amp; how fickle it is.

Maybe the solution is to take a h… https://t.co/rtVWyrx2E6",0,Twitter Web App,
HHHHH,2715772722,Aus,2023-01-21 00:55:13,@Lukewearechange crowder is trying to build his own platform at the expense of the daily wire. he was saying he wil… https://t.co/71mr3wTzev,0,Twitter Web App,
Colin Pear,302811479,"Austin, TX",2023-01-21 00:23:35,All of the big tech layoffs suck. At least they are getting outstanding severance packages. 30 weeks from Google! Wow!,0,Twitter for Android,
Verdict,1270795774364913666,"Austin, TX",2023-01-20 21:28:35,@SladeX2000 @pastorb_ifb @Fillenwar1Dalen @benshapiro Steven Crowder already follows the whims of YouTube. He speci… https://t.co/q4LfxxiBss,0,Twitter for Android,
Eric Clemmons,14457722,"Austin, TX",2023-01-20 20:59:12,"I remember being in a small company that was wildly profitable.

But the graph wasn’t going up and to the right as… https://t.co/NfbwhoR9Sq",0,Twitter for iPhone,
Clinton Rarey,1522329382001463296,Austin,2023-01-20 19:19:19,@Cdozo @LoewyLawFirm We've all been misled by big tech &amp; the renewable sector on how they do business. I don't blam… https://t.co/YJ1Skeut5N,0,Twitter for Android,
Wait Capital,998910748054179840,"Austin, TX",2023-01-20 19:02:43,"big tech going vertical  e.g., NVDA, MSFT, GOOGL, AAPL, which yields creep higher.",0,Twitter Web App,
Oracle,809273,"Austin, TX",2023-01-20 19:01:01,"From payment processing to inventory management, @ItsYourBigBoy selects our MICROS Simphony POS and Payment Cloud S… https://t.co/0cfF7BpuLo",6,Sprinklr,
Juan Pablo Chapa,1427694477737545729,"Austin, TX",2023-01-20 18:59:38,Given this continued growth (&amp; demand for talent) across the software industry we expect smaller tech companies to… https://t.co/glgE8rXTsk,0,Twitter for iPhone,
Nis,277155639,"Austin, TX",2023-01-20 17:37:07,@AdamSinger Big tech layoffs will shift talented people to far more productive roles elsewhere.,0,Twitter for iPhone,
Sam Padilla,247016876,"Austin, Texas",2023-01-20 16:53:08,"I don't care how anti Big Tech you are, if you celebrate people losing their jobs you are simply a terrible person.",0,Twitter Web App,
Curtis Michael,1116127207,Austin/Seattle,2023-01-20 16:04:18,"Big Tech layoffs 
- 12K at Google
- 10K at Microsoft
- 18K at Amazon
- 11K at Meta
- 4K at Twitter
- 8K at Salesforce",0,Twitter for iPhone,
Adam Singer,14031032,"Austin, TX",2023-01-20 15:52:22,"Take: big tech layoffs are now bad for all of US post-pandemic, no one should be cheering them on. Big tech jobs pa… https://t.co/4zAKqKwuzt",19,Twitter Web App,
Wait Capital,998910748054179840,"Austin, TX",2023-01-20 15:43:47,Big tech higher on Netflix’s earnings miss.,0,Twitter for iPhone,
Joe Crotchett,66944205,"Austin, TX",2023-01-20 15:35:17,"Now that Apple’s finally (and begrudgingly) bought in to VR, I have a theory that by the time big tech overcomes al… https://t.co/HEkidpkk1X",0,Twitter for iPhone,
Jrocktx,1514814731852255235,"Lakeway, TX",2023-01-20 15:23:04,@OfficeOfMike You’re correct. Most Americans are weak and would lay down to big tech for money and fame. Ask… https://t.co/vbITRgCPaG,0,Twitter for iPhone,
Mike Craven,360324361,"Irving, TX",2023-01-20 15:04:09,"Texas Tech 2022 Season in Review 

Joey McGuire’s Red Raiders smash expectations in year one. Is it Tech’s turn to… https://t.co/MyPfNXgPvM",5,Twitter for iPhone,
Austin Transit Blog,746133642691354624,"Austin, TX",2023-01-20 14:14:08,"@TheStalwart State Gov/UT are huge employers, also Austin tech sector historically is more semiconductor/hardware t… https://t.co/gvHLbTjMcC",0,Twitter Web App,
Deric,1593402784442884098,"Pflugerville, TX",2023-01-20 13:43:23,@LibertyLockPod Both sides have points but I think Crowder’s point highlights a major issue that needed to be broug… https://t.co/TvziLkJNUG,0,Twitter for iPhone,
Chip coy,55959581,"Austin, TX",2023-01-20 13:31:27,@IMAO_ You might have enjoyed watching to the end - Crowder’s demand is now no big tech fee deductions for his and… https://t.co/SSHWCt4Xnc,0,Twitter for iPhone,
Maralyn Burstein,713218818,"Austin, TX",2023-01-20 12:24:58,"@Wolfsbanecoins Big changes in the attitude towards tech stocks,possibly.
THINGS suddenly lurch forward-likely to b… https://t.co/Z3KPTq7JWT",0,Twitter Web App,
Stu,739502431189405697,"Austin, TX",2023-01-20 11:06:17,Awful. It’s been a horrible 6 months for big tech https://t.co/kDOhncclNX,0,Twitter Web App,
Gen3D Tech - David Sutton,1479942763139543043,"Austin, TX",2023-01-20 06:59:21,@FreshReviewsYT @mechkeysStore You should definitely check this mouse out though! It is big like the DAV3 but feels… https://t.co/zbu9PsbEw8,0,Twitter Web App,
Chris Michael Harris,622596896,"Austin, TX",2023-01-20 05:24:22,"@RealCandaceO Usually, I’m against that sort of behavior…but wow, Jeremy really showed his ass. He’s play fighting… https://t.co/KAZpJAgaZH",0,Twitter for iPhone,
Verdict,1270795774364913666,"Austin, TX",2023-01-20 04:12:53,@Zigmanfreud @benshapiro So you are admitting he does watch what he says on YouTube so that he doesn't get a perman… https://t.co/bSixhZhqZJ,0,Twitter Web App,
Verdict,1270795774364913666,"Austin, TX",2023-01-20 04:08:20,"@BretCrumbly @MarvelMom9 @RealCandaceO His whole thing is about how ""Big con is in league with big tech"" he himself… https://t.co/nPhgXKWUVt",0,Twitter Web App,
Tobs Dad,1213425349175824384,"Georgetown, TX",2023-01-20 03:12:35,"@scrowder You’ve seriously disappointed. This is a low. Idk what you’re dealing with, i hope you get through it but… https://t.co/A9HAXF6Qij",1,Twitter for iPhone,
Tobs Dad,1213425349175824384,"Georgetown, TX",2023-01-20 03:10:25,"Again, seems like @scrowder is on big tech side at this point. #DailyWire #Crowder https://t.co/EJ8KwTe4eb",0,Twitter for iPhone,
Tobs Dad,1213425349175824384,"Georgetown, TX",2023-01-20 03:08:14,"@MattWalshBlog Seems to me, big tech is in on this @scrowder stunt. More he pushes this, more fishy it sounds. Almo… https://t.co/HxMLFVkdOV",0,Twitter for iPhone,
Verdict,1270795774364913666,"Austin, TX",2023-01-20 02:35:44,Is Steven Crowder beholden to Big Tech? Does he specifically not say certain things on the YouTube part of his show… https://t.co/YokqpTP7eM,3,Twitter Web App,
ᚠᚢᚲ︍᛫ᛗᚨᚱᚲ󠄠ᛊ󠇯ᛁᛊᛗ,1586922244546203649,"Austin, TX",2023-01-19 23:20:20,@Unite4Us @CollinRugg One party is guilty of forceful suppression of the opposition through its  alignment  with co… https://t.co/Db2BrBalWk,0,Twitter for iPhone,
Eric Clemmons,14457722,"Austin, TX",2023-01-19 23:01:28,"@justinklemm @astrodotbuild Thanks!

Mine neither. It took big tech layoffs for me to write again 🫠",0,Twitter for iPhone,
Danny Davis,15649405,"Austin, Texas",2023-01-19 20:42:08,March 12 started off as a normal day. Was helping out with covering Texas at the Big 12 MBB tournament in KC. They… https://t.co/0hnVVia9g1,0,Twitter Web App,
Wait Capital,998910748054179840,"Austin, TX",2023-01-19 18:42:28,rallying into big tech earnings for the 14th year in a row. How surprising.,0,Twitter Web App,
Josh Wymer,57861292,"Austin, TX",2023-01-19 18:27:59,"7⃣👏👏👏 I'd now be ~30 years old w/ 💯 credentials, 💯 experience, a yr of savings, and $400k in my retirement acts. I'… https://t.co/u7l4KksL0s",0,Twitter Web App,
Josh Wymer,57861292,"Austin, TX",2023-01-19 18:27:07,"4⃣ Year 4 (~25 yr old), I'd jump to another big tech co as my initial equity grant has vested. 🙏 I'm now sr eng and… https://t.co/kckl51W7R2",0,Twitter Web App,
Josh Wymer,57861292,"Austin, TX",2023-01-19 18:26:36,2⃣ I would max my 401k contributions + 10% savings rate into taxable account (~25% overall). 401k matches at big te… https://t.co/zVZdyJnPhD,0,Twitter Web App,
Josh Wymer,57861292,"Austin, TX",2023-01-19 18:26:29,"1⃣ I would try to get a big tech job out of school. Ideally ""tier 1"" tech. Optimize for compensation and brand. Two… https://t.co/PMKzvNRQrh",0,Twitter Web App,
Josh Wymer,57861292,"Austin, TX",2023-01-19 18:26:10,"I’m 35 and spent the last 15 years as a software engineer in tech -- primarily in startups and scale-ups, but also… https://t.co/bilazR0RlV",1,Twitter Web App,
Cory McKane 🇺🇦,424417685,"Austin, TX",2023-01-19 17:11:52,"2.5 months until the big event!

So much to do but a lot of the big stuff is already taken care of

ATX Tech Beer P… https://t.co/sj6AYXcCfD",1,Twitter Web App,
Adam Loewy,872440976,"Austin, TX",2023-01-19 16:53:44,"@ClintonRarey That’s a good episode but if you can’t see the difference between these two issues, I can’t help you.… https://t.co/rOTMnTqCKb",0,Twitter for iPhone,
SIREN.,1387755383234744321,"Austin, TX",2023-01-19 13:02:06,"I really walked away from 2 big tech jobs &amp; one was the 6 fig cakeeee walkkkk job y’all be praying for …

All bc I… https://t.co/asjYlQeiB6",0,Twitter for iPhone,
Hookem.com,15165715,"Austin, Tx",2023-01-19 12:00:02,Texas Tech holds off No. 25 Texas in closing minutes for Big 12 women's basketball win https://t.co/toKyeHLFCI,0,SocialNewsDesk,
NIT Stu,955621214118207489,"Austin, TX",2023-01-19 05:59:25,What Virginia Tech needs to do is hide from the committees that Hunter Cattoor missed those games. They’ve got the… https://t.co/VyWnY1VbGc,1,Twitter for iPhone,
Paul Fieler,346205298,"Cedar Park, TX",2023-01-19 00:46:11,"@mattmezz @KevinKe72480208 @RitchieTorres Do you know that the 2020 election was fraught with massive fraud, includ… https://t.co/9rC1quLhpH",0,Twitter for iPhone,
Action Point Analytics,3182258893,"Austin, TX",2023-01-19 00:38:50,"""Big tech companies are retrenching, cutting expenses faster than they have in decades in an effort to navigate wha… https://t.co/aLKBv0F7Z1",0,Twitter Web App,
Johnny B,1578782425349558272,Communist City of Austin Texas,2023-01-18 22:33:32,@elonmusk No...nor should Big Tech.,0,Twitter for Android,
Paul Azunre,1210991649863561216,"Austin, TX",2023-01-18 20:01:33,"Here we go again 🤦🏽‍♂️ Big Tech treating Africa as an exploitation and extraction zone, while deliberately dragging… https://t.co/2o7QC4ka8V",0,Twitter for iPhone,
taylor desseyn,149212459,free resources👉🏻👉🏻,2023-01-18 20:01:29,hiring is still happening in tech. trust me. big tech just steals the headlines which i get https://t.co/qTBsUN0mRQ,2,Twitter for iPhone,
John Davis,121291508,"Austin, TX",2023-01-18 17:18:32,@mcspacface @DeItaone That's still a tiny amount out of the 214 million working agepeople in the US. It's just not… https://t.co/xKCbTzsLQS,0,Twitter Web App,
Alan Rabinovich,2854946950,"Austin, TX",2023-01-18 16:35:41,Microsoft launched a Neurodiversity Career Connector (NDCC) in collaboration with the nonprofit Disability:IN. Othe… https://t.co/pZc4dGmVCv,0,Powered by Sprinklr,
Ethan,1310893824,"Austin, TX",2023-01-18 16:17:53,@IGN Happening at every big tech company unfortunately sucks man,0,Twitter for iPhone,
Ethan,1310893824,"Austin, TX",2023-01-18 16:17:16,@charlieINTEL Happening at every big tech company sucks man,0,Twitter for iPhone,
Ambiq,2518081057,"Austin, Texas",2023-01-18 16:15:00,Startups and big tech are actively revolutionizing every aspect of the clinical trial process.  Read how Ambiq is c… https://t.co/zTO4tuHDBT,0,HubSpot,
Cart.com 🛒,1320539068640407559,"Austin, TX",2023-01-18 16:12:09,We're honored to be recognized by @BuiltIn as one of this year's Best Places to Work in Austin. A big thank you to… https://t.co/0pbyKO6CZ5,1,Sprout Social,
Ethan,1310893824,"Austin, TX",2023-01-18 16:03:12,"@klobrille Sucks but it’s happening at all big tech companies, hope the employees who lose their jobs are good.",1,Twitter for iPhone,
PeebsATX,2299004214,"Austin,TX",2023-01-18 15:54:25,@GOP Ah yes thanks god the boomers are here to protect us from Big Tech. The experts they are,0,Twitter for iPhone,
Oracle News,15102553,"Austin, TX",2023-01-18 15:09:02,Iconic restaurant chain @ItsYourBigBoy orders up Oracle MICROS Simphony Cloud and Oracle Payments Cloud service to… https://t.co/CbHed8PlT1,2,Sprinklr,
Austin Inno,2840008336,"Austin, TX ",2023-01-18 14:00:27,Money raised by Austin companies last week will help tech companies find remote employees in Latin America; underwr… https://t.co/XHaT4Fz6lI,0,True Anthem,
AustinBizJournal,24037404,"Austin, Texas ",2023-01-18 04:00:15,Money raised by Austin companies last week will help tech companies find remote employees in Latin America; underwr… https://t.co/uBfjSuj8hF,0,True Anthem,
Tyler W🌵,34124342,"Austin, TX",2023-01-18 03:47:45,Murphy’s law.  If big 12 refs can screw Texas Tech they will!,0,Twitter for iPhone,
Dan Isett 🌵 🏴‍☠️,20247181,"Austin, TX / Washington, DC",2023-01-18 03:29:28,"It's shocking, but Tech could very well go near-winless in the Big 12. I don't see *any* sure wins on the schedule… https://t.co/Wg2QMHZI2g",1,Twitter for Android,
threat to Democracy,1583395916,"Georgetown, TX",2023-01-18 03:20:51,"What he calls a problem, is really an opportunity. An opportunity to hear opposing views, to ensure that diverse op… https://t.co/QsruSumtd7",0,Twitter for iPad,
Edward,2551330513,"Austin, TX",2023-01-18 03:13:16,"Big Tech’s Layoffs Highlight How the US Fails Immigrant Workers
https://t.co/4KzXmuBWpx",0,Twitter for Android,
Just Zabros,135773449,"Austin, TX",2023-01-18 00:42:52,@strandjs How about a campaign about what WOULD protect you from big tech,0,Twitter for Android,
Hookem.com,15165715,"Austin, Tx",2023-01-17 21:59:02,"Ranked again, No. 25 Texas resumes its on-court rivalry with Texas Tech in Big 12 matchup https://t.co/L58wBXved8",2,SocialNewsDesk,
Clinton Rarey,1522329382001463296,Austin,2023-01-17 21:52:13,@LegendaryEnergy Don't give anyone the benefit of the doubt. You're either trustworthy or not. If they are shills f… https://t.co/wLhIdTExeg,0,Twitter for Android,
FUTO,1518632513580810241,"Austin, TX",2023-01-17 21:47:08,"Tech's next big fights 

https://t.co/rO1ieFEzMX",0,Twitter Web App,
Adam Singer,14031032,"Austin, TX",2023-01-17 20:03:27,@Cernovich Exactly right - and plenty of folk at these companies do work really hard which breaks people's brains.… https://t.co/vJt8XznuNG,0,Twitter Web App,
Adam Singer,14031032,"Austin, TX",2023-01-17 19:59:47,"Another day, more free PR for big tech perks. Convinced these are all just marketing to get young folk to work in b… https://t.co/XAWkanVKMA",0,Twitter Web App,
nehb,19793479,"Austin, TX",2023-01-17 19:46:11,@GOP Sure. As soon as they drop a dollar in your pocket it is Big Tech Who?,0,Twitter Web App,
AustinBizJournal,24037404,"Austin, Texas ",2023-01-17 19:00:26,Money raised by Austin companies last week will help tech companies find remote employees in Latin America; underwr… https://t.co/Hpad6naUev,0,True Anthem,
Big Ben,1015047568060043267,"Austin, TX",2023-01-17 17:54:30,"UT banning tik tok is stupid, the old heads in congress that don’t know how the technology works is stupid. Its fun… https://t.co/X7DLnuAwSH",0,Twitter for iPhone,
Mike Craven,360324361,"Irving, TX",2023-01-17 14:57:35,"Way-too-early Texas FBS Power Rankings favor #Hookem, #GigEm heading into 2023. 

Texas Tech poised for a Big 12 ru… https://t.co/LnA7mebCGg",4,Twitter for iPhone,
Spiceworks,14569371,"Austin, TX",2023-01-17 14:30:42,"Aviram Levy, head of the product enablement at Zesty, shares a detailed overview of the storage services available… https://t.co/bSPNpZWsnu",0,Twitter Web App,
Misha Gautreaux,85725115,"Austin, TX",2023-01-17 14:29:38,"This is not a big surprise -- the need for a good returns strategy, well thought out customer workflow(s), and a su… https://t.co/RURP95MdSG",0,LinkedIn,
Brendan Callaghan,1486197006985052160,"Austin, Texas",2023-01-17 14:24:48,"@Boenau It should really be the other way around. Road, parked car, curbed bike line, then big sidewalk.",0,Twitter for iPhone,
Accessibility News,887375226891366400,"Austin, TX",2023-01-17 14:00:19,The tech industry still has a long way to go when it comes to accessibility | Via @engadget https://t.co/ihmYJlDUzv #a11y,1,Buffer,
Byrne Hobart,2723411,"Austin, TX",2023-01-17 13:25:46,"Today's post is about Big Tech salaries, the college wage premium, and the Treaty of Detroit. https://t.co/ZXPjrtq2n9",1,Twitter Web App,
FOX 7 Austin,15850297,"Austin, TX",2023-01-17 03:30:13,A big reason for the Texas Longhorns men's basketball team's success in playing the role of comeback kids against T… https://t.co/0MElo1LimT,0,True Anthem,
JUST A GUY,1586095126639681537,"Austin, TX",2023-01-16 22:06:56,@POTUS Dude you forced people en masse to take experimental vaccines and colluded with big tech to violate the 1st… https://t.co/gKZ34hqpHq,0,Twitter for iPhone,
Longhorns Wire,1138516810725318656,"Austin, TX",2023-01-16 19:56:00,Sir’Jabari Rice earns Big 12 honors.  https://t.co/Ji3BwoQOBa,0,True Anthem,
Shelly Brisbin,798391,"Austin, Texas",2023-01-16 18:34:25,Enjoyed reading @CherlynnLow's  @engadget rundown of the past year's #a11y happenings at the big tech companies. https://t.co/x9JyMiFStX,1,TweetDeck,
Nick Moyle,2293485607,"Austin, TX",2023-01-16 18:09:24,"Texas climbs back into the women's AP Top 25. Horns (13-5, 4-1 Big 12) are No. 25 this week

UT has won 10 of 11 an… https://t.co/XlK0XRIlAK",0,Twitter Web App,
Jw8c🧢💀⚡️,1041665179,"Austin, Texas",2023-01-16 16:43:44,@farzyness That’s because they were a big social activist and censoring organization more than a tech company,0,Twitter for iPhone,
